<!ELEMENT laptop (manufacturer, model, memory, disk, screen, accessories+)>
<!ELEMENT manufacturer (name, country, continent)>
<!ELEMENT model (#PCDATA)>
<!ELEMENT memory (#PCDATA)>
<!ELEMENT disk (#PCDATA)>
<!ELEMENT screen (#PCDATA)>
<!ELEMENT accessories (#PCDATA)>
<!ELEMENT name (#PCDATA)>
<!ELEMENT country (#PCDATA)>
<!ELEMENT continent (#PCDATA)>
