<?xml version="1.0" encoding="UTF-8"?>
<!DOCTYPE laptop SYSTEM "laptop.dtd">
<laptop>
    <manufacturer>
        <name>Dell</name>
        <country>Poland</country>
        <continent>Europe</continent>
    </manufacturer>

    <model>Inspiron</model>
    <memory>512M</memory>
    <disk>60G</disk>
    <screen>15inch</screen>
    <accessories>Bag</accessories>
    <accessories>Mouse</accessories>
</laptop>